[
  {
    "index": "d20-test",
    "name": "D20 Test",
    "desc": [
      "When the outcome of an action is uncertain, the game uses a d20 roll to determine success or failure.",
      "These rolls are called D20 Tests, and they come in three kinds: ability checks, saving throws, and attack rolls.",
      "They follow these steps:",
      "1. Roll 1d20. You always want to roll high. If the roll has Advantage or Disadvantage, you roll two d20s, but you use the number from only one of them\u2014the higher one if you have Advantage or the lower one if you have Disadvantage.",
      "2. Add Modifiers. Add these modifiers to the number rolled on the d20: The Relevant Ability Modifier, Your Proficiency Bonus If Relevant, Circumstantial Bonuses and Penalties.",
      "3. Compare the Total to a Target Number. If the total of the d20 and its modifiers equals or exceeds the target number, the D20 Test succeeds. Otherwise, it fails."
    ],
    "category": "core",
    "page_reference": 5
  },
  {
    "index": "ability-checks",
    "name": "Ability Checks",
    "desc": [
      "An ability check represents a creature using talent and training to try to overcome a challenge, such as forcing open a stuck door, picking a lock, entertaining a crowd, or deciphering a cipher.",
      "The DM and the rules often call for an ability check when a creature attempts something other than an attack that has a chance of meaningful failure.",
      "When the outcome is uncertain and narratively interesting, the dice determine the result."
    ],
    "category": "core",
    "page_reference": 5
  },
  {
    "index": "saving-throws",
    "name": "Saving Throws",
    "desc": [
      "A saving throw\u2014also called a save\u2014represents an attempt to evade or resist a threat, such as a fiery explosion, a blast of poisonous gas, or a spell trying to invade your mind.",
      "You don't normally choose to make a save; you must make one because your character or a monster (if you're the DM) is at risk.",
      "A save's result is detailed in the effect that caused it.",
      "If you don't want to resist the effect, you can choose to fail the save without rolling."
    ],
    "category": "core",
    "page_reference": 6
  },
  {
    "index": "attack-rolls",
    "name": "Attack Rolls",
    "desc": [
      "An attack roll determines whether an attack hits a target.",
      "An attack roll hits if the roll equals or exceeds the target's Armor Class.",
      "Attack rolls usually occur in battle, described in Combat later in this chapter, but the DM might also ask for an attack roll in other situations, such as an archery competition."
    ],
    "category": "combat",
    "page_reference": 7
  },
  {
    "index": "advantage-disadvantage",
    "name": "Advantage/Disadvantage",
    "desc": [
      "Sometimes a D20 Test is modified by Advantage or Disadvantage.",
      "Advantage reflects the positive circumstances surrounding a d20 roll, while Disadvantage reflects negative circumstances.",
      "You usually acquire Advantage or Disadvantage through the use of special abilities and actions.",
      "The DM can also decide that circumstances grant Advantage or impose Disadvantage.",
      "When a roll has either Advantage or Disadvantage, roll a second d20 when you make the roll.",
      "Use the higher of the two rolls if you have Advantage, and use the lower roll if you have Disadvantage.",
      "If multiple situations affect a roll and they all grant Advantage on it, you still roll only two d20s.",
      "Similarly, if multiple situations impose Disadvantage on a roll, you roll only two d20s.",
      "If circumstances cause a roll to have both Advantage and Disadvantage, the roll has neither of them, and you roll one d20.",
      "This is true even if multiple circumstances impose Disadvantage and only one grants Advantage or vice versa."
    ],
    "category": "core",
    "page_reference": 8
  },
  {
    "index": "proficiency",
    "name": "Proficiency",
    "desc": [
      "Characters and monsters are good at various things.",
      "All creatures have a Proficiency Bonus, which reflects the impact that training has on the creature's capabilities.",
      "A character's Proficiency Bonus increases as the character gains levels.",
      "A monster's Proficiency Bonus is based on its Challenge Rating.",
      "This bonus is applied to a D20 Test when the creature has proficiency in a skill, in a saving throw, or with an item that the creature uses to make the D20 Test.",
      "The bonus is also used for spell attacks and for calculating the DC of saving throws for spells."
    ],
    "category": "core",
    "page_reference": 9
  },
  {
    "index": "armor-class",
    "name": "Armor Class",
    "desc": [
      "A creature's Armor Class represents how well the creature avoids being wounded in combat.",
      "The AC of a character is determined at character creation, whereas the AC of a monster appears in its stat block.",
      "All creatures start with the same base AC calculation: Base AC = 10 + the creature's Dexterity modifier.",
      "A creature's AC can then be modified by armor, magic items, spells, and more.",
      "Some spells and class features give characters a different way to calculate their AC.",
      "A character with multiple features that give different ways to calculate AC must choose which one to use; only one base calculation can be in effect for a creature."
    ],
    "category": "combat",
    "page_reference": 7
  },
  {
    "index": "critical-hits",
    "name": "Critical Hits",
    "desc": [
      "When you roll a 20 on the d20 (called a natural 20) for an attack roll, the attack hits regardless of any modifiers or the target's AC.",
      "This is called a Critical Hit.",
      "When you score a Critical Hit, you deal extra damage.",
      "Roll the attack's damage dice twice, add them together, and add any relevant modifiers as normal.",
      "If the attack involves other damage dice, such as from the Rogue's Sneak Attack feature, you also roll those dice twice."
    ],
    "category": "combat",
    "page_reference": 25
  },
  {
    "index": "damage-types",
    "name": "Damage Types",
    "desc": [
      "Each instance of damage has a type, like Fire or Slashing.",
      "Damage types are listed in the rules glossary and have no rules of their own.",
      "Other rules, such as Resistance, rely on damage types."
    ],
    "category": "combat",
    "page_reference": 26
  },
  {
    "index": "resistance-vulnerability",
    "name": "Resistance and Vulnerability",
    "desc": [
      "Some creatures and objects have Resistance or Vulnerability to certain damage types.",
      "If you have Resistance to a damage type, damage of that type is halved against you (round down).",
      "If you have Vulnerability to a damage type, damage of that type is doubled against you.",
      "Multiple instances of Resistance or Vulnerability that affect the same damage type count as only one instance.",
      "Modifiers to damage are applied in the following order: adjustments such as bonuses, penalties, or multipliers are applied first; Resistance is applied second; and Vulnerability is applied third."
    ],
    "category": "combat",
    "page_reference": 26
  },
  {
    "index": "immunity",
    "name": "Immunity",
    "desc": [
      "Some creatures and objects have Immunity to certain damage types and conditions.",
      "Immunity to a damage type means you don't take damage of that type.",
      "Immunity to a condition means you aren't affected by it."
    ],
    "category": "combat",
    "page_reference": 27
  },
  {
    "index": "cover",
    "name": "Cover",
    "desc": [
      "Walls, trees, creatures, and other obstacles can provide cover, making a target more difficult to harm.",
      "There are three degrees of cover, each of which gives a different benefit to a target.",
      "A target can benefit from cover only when an attack or other effect originates on the opposite side of the cover.",
      "If a target is behind multiple sources of cover, only the most protective degree of cover applies.",
      "Half Cover: +2 bonus to AC and Dexterity saving throws.",
      "Three-Quarters Cover: +5 bonus to AC and Dexterity saving throws.",
      "Total Cover: Can't be targeted directly."
    ],
    "category": "combat",
    "page_reference": 23
  }
]